{
  "schema_version": 1,
  "category": "approval",
  "status": "passed",
  "app_version": "0.4.0-alpha.15",
  "hermes_range": ">=0.22.2",
  "git_head": "a436f1ce9b888da0ec6d62ae8e6e8f54d1f6dae4",
  "git_state": "working-tree",
  "subject_scheme": 5,
  "subject_fingerprint": "5c4e21ba9eb7bf0f38da78038e0f86c6d3eaf4b9d9b5e0fa757abdca82461b3c",
  "captured_at": "2026-10-18T15:17:54.445Z",
  "tool": "e2e-installed-isolated.mjs (real gateway approval server request/response)",
  "redacted": true,
  "summary": {
    "wiring": {
      "official_method": "JSON-RPC approval response",
      "competing_engine": false,
      "delegates_to_official": true
    },
    "unit_coverage": true,
    "live_ui_denial_probe": {
      "status": "passed",
      "artifact_attested": true,
      "qa_namespace_applied": true,
      "isolated_runtime": true,
      "via_real_event_path": true,
      "official_method": "JSON-RPC approval response",
      "requested": true,
      "request_command_present": true,
      "denied": true,
      "response_sent": true,
      "no_side_effect": true,
      "renderer_modal_faked": false
    }
  }
}
