{
  "schema_version": 1,
  "category": "shared-state",
  "status": "passed",
  "app_version": "0.4.0-alpha.16",
  "hermes_range": ">=0.22.2",
  "git_head": "a342d0b1faa46fdd034ea0d9bdfc2947e81badc0",
  "git_state": "working-tree",
  "subject_scheme": 5,
  "subject_fingerprint": "1052c673faafb0d971a1ad8f32e91c22771fa23bc1e7482beb2be84c1a163c8b",
  "captured_at": "2026-10-18T17:28:14.526Z",
  "tool": "e2e-hermes-shared-state.mjs",
  "redacted": true,
  "summary": {
    "ok": true,
    "health": true,
    "provider_free": true,
    "live_home_untouched": true,
    "session_shared": {
      "via_rest": true,
      "via_rpc": true
    },
    "cron_shared": {
      "via_rpc": true,
      "on_disk": true,
      "removed": true
    },
    "skill_shared": {
      "via_rpc": true,
      "skill_count": 53
    },
    "path_evidence": {
      "under_isolated_home": true,
      "present": {
        "home": true,
        "plugins": true,
        "desktop_plugins": true,
        "memories": true,
        "skills": true,
        "sessions": true,
        "cron": true,
        "workspace_db": true
      }
    },
    "plugin": {
      "installed": true,
      "integrity_verified": true,
      "status": "loaded",
      "enabled": true,
      "contributions_count": 3,
      "route_provider_free": true,
      "shared_state": {
        "provider_ready": true,
        "session_visible_via_plugin_host": true,
        "cron_list_ok": true,
        "bootstrap_skill_visible": true
      },
      "uninstall": {
        "disk_door_empty": true,
        "residue_gone": true,
        "writes_confined_to_isolated_home": true
      }
    },
    "approval_mapping": {
      "official_method": "JSON-RPC approval response",
      "competing_engine": false
    }
  }
}
