{
  "schema_version": 1,
  "category": "thin-installer",
  "status": "passed",
  "app_version": "0.4.0-alpha.15",
  "hermes_range": ">=0.22.2",
  "git_head": "a436f1ce9b888da0ec6d62ae8e6e8f54d1f6dae4",
  "git_state": "working-tree",
  "subject_scheme": 5,
  "subject_fingerprint": "616af68c4444a2892bb736247f87d7f498021a80799e810a4700c22511e41f83",
  "captured_at": "2026-10-18T14:54:29.539Z",
  "tool": "e2e-thin-network-installer.ps1",
  "redacted": true,
  "summary": {
    "ok": true,
    "isolated": true,
    "cases_total": 9,
    "cases_passed": 9,
    "all_cases_green": true
  }
}
