{
  "schema_version": 1,
  "category": "packaged-e2e",
  "status": "passed",
  "app_version": "0.4.0-alpha.15",
  "hermes_range": ">=0.22.2",
  "git_head": "a436f1ce9b888da0ec6d62ae8e6e8f54d1f6dae4",
  "git_state": "working-tree",
  "subject_scheme": 5,
  "subject_fingerprint": "cce3194a21cd31ddf73c1db8a674eb3f702fd25f2fd4ca0a378e4b996336a847",
  "captured_at": "2026-10-18T15:17:47.788Z",
  "tool": "e2e-installed-isolated.mjs",
  "redacted": true,
  "summary": {
    "build_nonce": "ff3e3235dd3af55e4d106d893788e565",
    "release_binding_digest": "0df2e92831fcae5b9e80cc4ec2fd3fcb2c208e1e3324a45cadab8476f6fe9b70",
    "installer_sha256": "7b5de9af85caeee9281c82bec80fddaa41583140f9449019390c18ec425a73b7",
    "capture_method": "machine",
    "capture_ok": true,
    "ran": true,
    "artifact_attested": true,
    "artifact_kind": "win-unpacked-current",
    "qa_namespace_applied": true,
    "isolated_runtime": true,
    "ws_on_isolated_port": true,
    "isolated_session_count": 0,
    "isolated_home_populated": true,
    "live_home_untouched": true,
    "live_config_unchanged": true,
    "live_cron_jobs_unchanged": true,
    "live_marker_stable_equal": true,
    "live_structural_additions": 0,
    "live_content_rewrites": 0,
    "live_unsafe_entries": 0,
    "live_volatile_runtime_changes": 0,
    "temp_home_removed": true,
    "isolated_port_free": true,
    "owned_tree_dead": true,
    "no_residual": true
  }
}
